{
  "$schema": "https://json-schema.org/draft/2020-12/schema",
  "$id": "https://revealjs-presentation.local/schemas/deck-manifest-v1.json",
  "title": "Reveal.js Presentation Deck Manifest",
  "type": "object",
  "additionalProperties": false,
  "required": [
    "manifestVersion",
    "deckId",
    "title",
    "topic",
    "audience",
    "language",
    "voice",
    "route",
    "output",
    "slides"
  ],
  "properties": {
    "manifestVersion": { "const": "1.0" },
    "deckId": { "type": "string", "pattern": "^[a-z0-9][a-z0-9-]{2,63}$" },
    "title": { "type": "string", "minLength": 1, "maxLength": 120 },
    "topic": { "type": "string", "minLength": 1, "maxLength": 160 },
    "audience": { "type": "string", "minLength": 1, "maxLength": 160 },
    "language": { "enum": ["zh-CN", "en"] },
    "voice": { "type": "string", "minLength": 1 },
    "route": {
      "type": "object",
      "additionalProperties": false,
      "required": ["path", "wow"],
      "properties": {
        "path": { "enum": ["A", "B", "C"] },
        "wow": { "type": "boolean" }
      }
    },
    "output": {
      "type": "object",
      "additionalProperties": false,
      "required": ["html"],
      "properties": {
        "html": { "type": "string", "minLength": 1 },
        "pptx": { "type": "string", "minLength": 1 }
      }
    },
    "slides": {
      "type": "array",
      "minItems": 1,
      "items": {
        "type": "object",
        "additionalProperties": false,
        "required": [
          "id",
          "role",
          "contentType",
          "archetype",
          "variantParams",
          "props",
          "proofObject",
          "mediaSlots",
          "evidence",
          "motionIntent"
        ],
        "properties": {
          "id": { "type": "string", "pattern": "^[a-z0-9][a-z0-9-]{1,63}$" },
          "role": { "enum": ["cover", "context", "proof", "mechanism", "decision", "close"] },
          "contentType": {
            "enum": [
              "cover",
              "thesis",
              "chronology",
              "chapter",
              "data-anchor",
              "comparison",
              "kpi",
              "mechanism",
              "evidence-table",
              "quote",
              "takeaways",
              "closing",
              "image-compare"
            ]
          },
          "archetype": {
            "enum": ["A1", "A2", "A3", "A4", "A5", "A6", "A7", "A8", "A9", "A10", "A11", "A12", "IMG"]
          },
          "variantParams": { "type": "object" },
          "props": { "type": "object" },
          "proofObject": {
            "type": "object",
            "additionalProperties": false,
            "required": ["type", "claim"],
            "properties": {
              "type": { "enum": ["statement", "metric", "table", "diagram", "image", "quote", "code"] },
              "claim": { "type": "string", "minLength": 1 }
            }
          },
          "mediaSlots": { "type": "array" },
          "evidence": {
            "type": "array",
            "description": "Per-claim evidence sources. Semantic rules (enforced by scripts/deck-manifest.js validateDeckManifest): verified requires source.{url,locator,checkedAt}; user-provided requires note; illustrative forbids source; claimId must equal the owning slide id. Each id is stamped into the rendered HTML as data-evidence-id for auditability.",
            "items": {
              "type": "object",
              "additionalProperties": false,
              "required": ["id", "claimId", "status", "label"],
              "properties": {
                "id": { "type": "string", "minLength": 1 },
                "claimId": { "type": "string", "minLength": 1 },
                "status": { "enum": ["verified", "user-provided", "illustrative", "needs-source"] },
                "label": { "type": "string", "minLength": 1 },
                "note": { "type": "string", "minLength": 1 },
                "source": {
                  "type": "object",
                  "additionalProperties": false,
                  "required": ["url", "locator", "checkedAt"],
                  "properties": {
                    "url": { "type": "string", "pattern": "^https?://" },
                    "locator": { "type": "string", "minLength": 1 },
                    "checkedAt": { "type": "string", "format": "date" }
                  }
                }
              }
            }
          },
          "motionIntent": { "enum": ["none", "fragment", "loop", "count-in", "draw", "grow"] }
        }
      }
    }
  }
}
